question,answer
What is LoLLMs WebUI?,LoLLMs WebUI is a user-friendly interface that provides access to various Large Language Model (LLM) models for a wide range of tasks.
What are the features of LoLLMs WebUI?,The features of LoLLMs WebUI include:<br>- Choosing preferred binding, model, and personality<br>- Enhancing emails, essays, code debugging, thought organization, and more<br>- Exploring functionalities like searching, data organization, and image generation<br>- Easy-to-use UI with light and dark mode options<br>- Integration with GitHub repository<br>- Support for different personalities with predefined welcome messages<br>- Thumb up/down rating for generated answers<br>- Copy, edit, and remove messages<br>- Local database storage for discussions<br>- Search, export, and delete multiple discussions<br>- Support for Docker, conda, and manual virtual environment setups
Where can I find a tutorial on how to use the tool?,You can find a tutorial on how to use the tool on our YouTube channel. Click here to watch the tutorial: <a href="https://youtu.be/ds_U0TDzbzI">YouTube Tutorial</a>
What are the prerequisites for installing LoLLMs WebUI?,The prerequisites for installing LoLLMs WebUI are:<br>- Python 3.10 or higher<br>- Git (for cloning the repository)<br>Make sure Python is in your system's PATH and verify the Python version by running 'python --version' in the terminal.
How do I install LoLLMs WebUI?,There are different installation methods for LoLLMs WebUI:<br>1. Easy install:<br>- Download the appropriate launcher for your platform (webui.bat for Windows, webui.sh for Linux).<br>- Place the launcher in a folder of your choice.<br>- Run the launcher script.<br>2. Using Conda:<br>- Clone the project or download the zip file from the GitHub repository.<br>- Create a new conda environment, activate it, and install the requirements.<br>3. Using Docker:<br>- Refer to the Docker documentation for installation instructions specific to your operating system.
How do I launch the app?,You can launch the app by running the webui.sh or webui.bat launcher. Alternatively, you can activate the virtual environment and launch the application using 'python app.py' from the project's root directory.
How do I select a model and binding?,To select a model and binding:<br>- Open the LoLLMs WebUI and go to the Settings page.<br>- In the Models Zoo tab, choose a binding from the list.<br>- Wait for the installation process to finish and click the Install button next to the desired model.<br>- After the model installation is complete, select the model and apply the changes.<br>- Don't forget to save the configuration.
How do I start a discussion?,To start a discussion:<br>- Go to the Discussions view.<br>- Click the + button to create a new discussion.<br>- You will see a predefined welcome message based on the selected personality.<br>- Ask a question or provide an initial prompt to start the discussion.<br>- You can stop the generation process at any time by pressing the Stop Generating button.
How do I manage discussions?,To manage discussions:<br>- To edit a discussion title, simply type a new title or modify the existing one.<br>- To delete a discussion, click the Delete button.<br>- To search for specific discussions, use the search button and enter relevant keywords.<br>- To perform batch operations (exporting